{
  "$schema": "../../schemas/youtube-match.schema.json",
  "schemaVersion": "1.0",
  "mixSlug": "mix-025-twentyfifth",
  "updatedAt": "2026-04-08T21:23:12Z",
  "sourceMixPath": "data/imported/mixes/mix-025-twentyfifth.json",
  "tracks": [
    {
      "position": 1,
      "displayText": "La Rocca - Non-Believer",
      "query": "La Rocca Non-Believer",
      "resolution": {
        "status": "auto-resolved",
        "selectedVideoId": "UK6BkZxrhck",
        "confidenceScore": 0.999,
        "reason": "Top YouTube candidate cleared MMM's auto-select threshold and best matched the track with audio-first signals.",
        "holdbackReason": null
      },
      "candidates": [
        {
          "rank": 1,
          "videoId": "UK6BkZxrhck",
          "title": "La Rocca - Non Believer",
          "url": "https://www.youtube.com/watch?v=UK6BkZxrhck",
          "channel": "muhmuh04",
          "durationSeconds": 310.0,
          "score": 0.999,
          "signals": [
            "candidate-title-covers-track-tokens",
            "display-text-near-exact-match",
            "artist-name-in-title",
            "song-title-in-title"
          ]
        },
        {
          "rank": 2,
          "videoId": "CUkchcWIBhk",
          "title": "15 la rocca non believer",
          "url": "https://www.youtube.com/watch?v=CUkchcWIBhk",
          "channel": "OneTreeHillMusik",
          "durationSeconds": 305.0,
          "score": 0.999,
          "signals": [
            "candidate-title-covers-track-tokens",
            "display-text-near-exact-match",
            "artist-name-in-title",
            "song-title-in-title"
          ]
        },
        {
          "rank": 3,
          "videoId": "_5YTjJ_UPhk",
          "title": "La Rocca - Non-Believer Live",
          "url": "https://www.youtube.com/watch?v=_5YTjJ_UPhk",
          "channel": "joeythebutcher",
          "durationSeconds": 36.0,
          "score": 0.762,
          "signals": [
            "candidate-title-covers-track-tokens",
            "artist-name-in-title",
            "song-title-in-title",
            "live-version-penalty"
          ]
        },
        {
          "rank": 4,
          "videoId": "gS91nSC0BAU",
          "title": "Non Believer",
          "url": "https://www.youtube.com/watch?v=gS91nSC0BAU",
          "channel": "La Rocca - Topic",
          "durationSeconds": 305.0,
          "score": 0.678,
          "signals": [
            "song-title-near-exact-match",
            "song-title-in-title",
            "artist-name-in-channel",
            "topic-channel"
          ]
        },
        {
          "rank": 5,
          "videoId": "uBnVXvVtc8Y",
          "title": "One Tree Hill best music moment #4 - Non-Believer",
          "url": "https://www.youtube.com/watch?v=uBnVXvVtc8Y",
          "channel": "ShannenDoherty12",
          "durationSeconds": 214.0,
          "score": 0.298,
          "signals": [
            "song-title-in-title"
          ]
        }
      ]
    },
    {
      "position": 2,
      "displayText": "Warpaint - Elephants",
      "query": "Warpaint Elephants",
      "resolution": {
        "status": "auto-resolved",
        "selectedVideoId": "UXdrw9LO77I",
        "confidenceScore": 0.999,
        "reason": "Top YouTube candidate cleared MMM's auto-select threshold and best matched the track with audio-first signals.",
        "holdbackReason": null
      },
      "candidates": [
        {
          "rank": 1,
          "videoId": "UXdrw9LO77I",
          "title": "Warpaint - Elephants",
          "url": "https://www.youtube.com/watch?v=UXdrw9LO77I",
          "channel": "xalsr",
          "durationSeconds": 280.0,
          "score": 0.999,
          "signals": [
            "candidate-title-covers-track-tokens",
            "display-text-near-exact-match",
            "artist-name-in-title",
            "song-title-in-title"
          ]
        },
        {
          "rank": 2,
          "videoId": "yOFxb0F2F2A",
          "title": "Warpaint - Elephants (Official Music Video)",
          "url": "https://www.youtube.com/watch?v=yOFxb0F2F2A",
          "channel": "The FADER",
          "durationSeconds": 279.0,
          "score": 0.797,
          "signals": [
            "candidate-title-covers-track-tokens",
            "artist-name-in-title",
            "song-title-in-title",
            "official-upload",
            "music-video-penalty"
          ]
        },
        {
          "rank": 3,
          "videoId": "T_S75dE7PzE",
          "title": "Warpaint | \"Elephants\" | Pitchfork Music Festival Paris 2014 | PitchforkTV",
          "url": "https://www.youtube.com/watch?v=T_S75dE7PzE",
          "channel": "Pitchfork",
          "durationSeconds": 490.0,
          "score": 0.772,
          "signals": [
            "candidate-title-covers-track-tokens",
            "artist-name-in-title",
            "song-title-in-title"
          ]
        },
        {
          "rank": 4,
          "videoId": "0zjXo9haDf0",
          "title": "Warpaint - 'Elephants' (Live 2017)",
          "url": "https://www.youtube.com/watch?v=0zjXo9haDf0",
          "channel": "at WarpLoT",
          "durationSeconds": 300.0,
          "score": 0.702,
          "signals": [
            "candidate-title-covers-track-tokens",
            "artist-name-in-title",
            "song-title-in-title",
            "live-version-penalty"
          ]
        },
        {
          "rank": 5,
          "videoId": "Il5cHpsN1N8",
          "title": "\"Elephants\" by Warpaint Live Session (Presented by Noisevox)",
          "url": "https://www.youtube.com/watch?v=Il5cHpsN1N8",
          "channel": "APinhert",
          "durationSeconds": 537.0,
          "score": 0.471,
          "signals": [
            "candidate-title-covers-track-tokens",
            "artist-name-in-title",
            "song-title-in-title",
            "live-version-penalty",
            "unexpected-session-penalty"
          ]
        }
      ]
    },
    {
      "position": 3,
      "displayText": "I’m From Barcelona - The Painter",
      "query": "I’m From Barcelona The Painter",
      "resolution": {
        "status": "auto-resolved",
        "selectedVideoId": "pq-8eYMjEVM",
        "confidenceScore": 0.861,
        "reason": "Top YouTube candidate cleared MMM's auto-select threshold and best matched the track with audio-first signals.",
        "holdbackReason": null
      },
      "candidates": [
        {
          "rank": 1,
          "videoId": "pq-8eYMjEVM",
          "title": "\"The Painter\" by I'm from Barcelona",
          "url": "https://www.youtube.com/watch?v=pq-8eYMjEVM",
          "channel": "Anders Herrmann",
          "durationSeconds": 211.0,
          "score": 0.861,
          "signals": [
            "candidate-title-covers-track-tokens",
            "artist-name-in-title",
            "song-title-in-title"
          ]
        },
        {
          "rank": 2,
          "videoId": "b2qaq5Jrqk0",
          "title": "HIMYM - The Painter - I'm from Barcelona",
          "url": "https://www.youtube.com/watch?v=b2qaq5Jrqk0",
          "channel": "Xin Huang",
          "durationSeconds": 90.0,
          "score": 0.848,
          "signals": [
            "candidate-title-covers-track-tokens",
            "artist-name-in-title",
            "song-title-in-title"
          ]
        },
        {
          "rank": 3,
          "videoId": "82wQYJkjH_A",
          "title": "I'm From Barcelona - The Painter (Live)",
          "url": "https://www.youtube.com/watch?v=82wQYJkjH_A",
          "channel": "Radial by The Orchard",
          "durationSeconds": 186.0,
          "score": 0.743,
          "signals": [
            "candidate-title-covers-track-tokens",
            "display-text-near-exact-match",
            "artist-name-in-title",
            "song-title-in-title",
            "live-version-penalty"
          ]
        },
        {
          "rank": 4,
          "videoId": "dE4IM20IEy4",
          "title": "I'm From Barcelona - The Painter (Live in the Secret Garden)",
          "url": "https://www.youtube.com/watch?v=dE4IM20IEy4",
          "channel": "festivalboy22",
          "durationSeconds": 215.0,
          "score": 0.648,
          "signals": [
            "candidate-title-covers-track-tokens",
            "artist-name-in-title",
            "song-title-in-title",
            "live-version-penalty"
          ]
        },
        {
          "rank": 5,
          "videoId": "M2FQWNbBJZE",
          "title": "The Painter",
          "url": "https://www.youtube.com/watch?v=M2FQWNbBJZE",
          "channel": "I'm from Barcelona - Topic",
          "durationSeconds": 211.0,
          "score": 0.621,
          "signals": [
            "song-title-near-exact-match",
            "song-title-in-title",
            "artist-name-in-channel",
            "topic-channel"
          ]
        }
      ]
    },
    {
      "position": 4,
      "displayText": "Ben Howard - Old Pine",
      "query": "Ben Howard Old Pine",
      "resolution": {
        "status": "auto-resolved",
        "selectedVideoId": "x8ccDb6n5Wg",
        "confidenceScore": 0.999,
        "reason": "Top YouTube candidate cleared MMM's auto-select threshold and best matched the track with audio-first signals.",
        "holdbackReason": null
      },
      "candidates": [
        {
          "rank": 1,
          "videoId": "x8ccDb6n5Wg",
          "title": "Ben Howard - Old Pine",
          "url": "https://www.youtube.com/watch?v=x8ccDb6n5Wg",
          "channel": "Ben Howard",
          "durationSeconds": 334.0,
          "score": 0.999,
          "signals": [
            "candidate-title-covers-track-tokens",
            "display-text-near-exact-match",
            "artist-name-in-title",
            "song-title-in-title",
            "artist-name-in-channel"
          ]
        },
        {
          "rank": 2,
          "videoId": "t75MIHcbH34",
          "title": "Ben Howard - Old Pine",